{
  "$schema":"https://json-schema.org/draft/2020-12/schema",
  "$id":"urn:f1-cache-replay:schema:replay-data:v2:track-assets",
  "title":"Browser delivery v2 track assets","type":"object","additionalProperties":false,
  "required":["contractVersion","fixtureId","trackId","trackName","coordinateSpace","circuitLengthMeters","rotationDegrees","startFinish","centerLine","innerBoundary","outerBoundary"],
  "$defs":{"point":{"type":"object","additionalProperties":false,"required":["x","y"],"properties":{"x":{"type":"number"},"y":{"type":"number"}}},"line":{"type":"array","minItems":4,"items":{"$ref":"#/$defs/point"}},"reference":{"type":"object","additionalProperties":false,"required":["path","schemaId"],"properties":{"path":{"const":"track-assets.json"},"schemaId":{"const":"urn:f1-cache-replay:schema:replay-data:v2:track-assets"},"sha256":{"type":"string","pattern":"^[0-9a-f]{64}$"}}}},
  "properties":{"contractVersion":{"const":"v2"},"fixtureId":{"type":"string","pattern":"^[a-z0-9]+(?:-[a-z0-9]+)*$"},"trackId":{"type":"string","pattern":"^[a-z0-9]+(?:-[a-z0-9]+)*$"},"trackName":{"type":"string","minLength":1},"coordinateSpace":{"type":"object","additionalProperties":false,"required":["units","origin"],"properties":{"units":{"const":"meters"},"origin":{"type":"string","minLength":1}}},"circuitLengthMeters":{"type":"number","exclusiveMinimum":0},"rotationDegrees":{"type":"number"},"startFinish":{"type":"object","additionalProperties":false,"required":["center","inner","outer"],"properties":{"center":{"$ref":"#/$defs/point"},"inner":{"$ref":"#/$defs/point"},"outer":{"$ref":"#/$defs/point"}}},"centerLine":{"$ref":"#/$defs/line"},"innerBoundary":{"$ref":"#/$defs/line"},"outerBoundary":{"$ref":"#/$defs/line"},"distanceMarkersMeters":{"type":"array","items":{"type":"integer","minimum":0},"uniqueItems":true},"drsZones":{"type":"array","items":{"type":"object","additionalProperties":false,"required":["startMeters","endMeters"],"properties":{"startMeters":{"type":"number","minimum":0},"endMeters":{"type":"number","minimum":0}}}}}
}
